,product_name,ratings,no_of_ratings,sold_num,original_price,current_price,discount_amount,price_of_1,brand_name
716,Dark Green Nepal Printed 100% Cotton T-Shirt For Men - 02,4.0,3.0,0,0,350,0,350.0,Other
717,Yuva Clothing's White Cotton Applecut Round Neck Half Sleeve T-Shirt For Men,5.0,2.0,0,750,500,250,500.0,Other
718,Pack Of 3 Buddha Printed 100% Cotton T-Shirt For Men-Blue/Red/Black - 05,,,0,0,1000,0,333.3333333333333,Other
719,Men 3pcs Round Neck Solid T-shirts,,,0,1999,1090,909,1090.0,Other
720,Black Casual Linkin Park Printed T-Shirt For Men,4.3,20.0,100,0,450,0,450.0,Other
721,Grey Cotton Round Neck Buddha Nepal Printed T-Shirt For Men,5.0,2.0,0,0,450,0,450.0,Other
723,Summer Knitted Solid Color Short Sleeves T-Shirt For Men - Multicolor | Multisize | Fashion | T-Shirt For Men,3.7,6.0,32,3500,1999,1501,1999.0,Other
724,Hills And Clouds & Space Guitar T-Shirt (Black\White) For Men,4.0,2.0,0,1200,780,420,780.0,Hills And Clouds
725,Blue Nepal Printed 100% Cotton T-Shirt For Men - 02,5.0,2.0,0,0,350,0,350.0,Other
726,Grey Cotton Round Neck Little Buddha Printed T-Shirt For Men,5.0,1.0,0,0,450,0,450.0,Other
727,Hills And Clouds & Space Guitar T-Shirt (Grey/White) For Men,4.4,9.0,34,1200,780,420,780.0,Hills And Clouds
728,Half Sleeves T-Shirt For Men,,,0,0,300,0,300.0,Other
729,Pack Of 3 Buddha Printed 100% Cotton T-Shirt For Men-Blue/White/Maroon - 019,,,0,0,1000,0,333.3333333333333,Other
730,Henna Green Plain T-Shirt For Men,4.0,3.0,0,0,330,0,330.0,Other
731,Dark Green Casual T-Shirt for Men,3.2,5.0,0,500,399,101,399.0,Other
732,Binay Embroidery Full sleeve Black Buddha Printed T-Shirt For Men - Fashion | T-Shirts For Men | Men's Upper Wear | T-Shirts |,,,0,750,549,201,549.0,Binay Embroidery
733,Black Cotton Round Neck Half Sleeve Printed T-Shirt With Shorts Set For Men,,,0,0,1500,0,1500.0,Other
734,Deadpool Printed Regular Cotton T-Shirt for Men,4.7,7.0,31,1065,852,213,852.0,Other
735,Nyptra Light Grey Premium Muscle Fit Plain Cotton T-Shirt For Men - Fashion | T-Shirts For Men | Men's Wear |,5.0,1.0,0,1600,600,1000,600.0,nyptra
736,Doro Sky Blue Cotton V-Neck Half Sleeve Side Printed T-Shirt For Men,,,0,0,935,0,935.0,Doro
737,Grey Cotton Round Neck Little Buddha Printed T-Shirt For Men,5.0,2.0,0,0,450,0,450.0,Other
738,Combo Of 3 Cotton Tie Dye T-Shirt For Men- Grey/Green/Blue,4.7,36.0,278,0,1500,0,500.0,Other
739,Hills And Clouds & Graphic Series T-Shirt [Aham Bramasmi (Skull)] {White} For Men,4.3,4.0,0,899,584,315,584.0,Hills And Clouds
740,Red Round Neck Plain 100% Cotton T-Shirt For Men,5.0,5.0,31,0,400,0,400.0,Other
741,Beige Plain T-Shirt For Men,4.5,4.0,0,0,330,0,330.0,Other
742,Navy Blue Buddha Printed 100% Cotton T-Shirt For Men - 05,4.5,2.0,0,0,350,0,350.0,Other
743,Gurkha Printed T-Shirt For Men,5.0,3.0,0,0,650,0,650.0,Other
744,Bts Cross Logo Printed T-Shirt For Men,,,0,0,750,0,750.0,logo
745,Brick Orange Plain T-Shirt For Men,4.0,2.0,0,0,330,0,330.0,Other
746,Light Green Pure Cotton Printed Round Neck Premium T-shirt For Men,4.0,1.0,0,0,620,0,620.0,Other
747,Binay Embroidery Black/Golden Endless Knot Printed T-Shirt For Men - Fashion | T-Shirts For Men | Men's Upper Wear | T-Shirts |,4.3,6.0,40,0,450,0,450.0,Binay Embroidery
748,Black/White Pure Cotton Round Neck Premium T-shirt For Men-Pack Of 2,4.7,3.0,0,1200,949,251,474.5,Other
749,NASA Regular Cotton T-Shirt for Men,4.4,22.0,129,1065,852,213,852.0,Other
750,Cotton Striped T-Shirt For Men,3.9,23.0,171,0,900,0,900.0,Other
751,Shangrila Pack Of 2 Cotton Printed T-Shirts For Men-Blue/Green - Fashion | T-Shirts For Men | Men's Wear | Printed T-Shirts |,2.5,2.0,0,0,750,0,375.0,Shangrila
752,Venom Printed Regular Cotton T-Shirt for Men - Multicolor | Multisize | Fashion | T-Shirts For Men,4.8,19.0,145,1065,852,213,852.0,Other
753,Kilometer Long Sleeve T-Shirt Kmr1005 For Men - Multicolor | Multisize | Fashion | Long Sleeves T-Shirts For Men,4.0,18.0,65,0,1850,0,1850.0,kilometer
754,California Surfing Combed Cotton Tshirt For Men - White | Multisize | Fashion | Half Sleeves T-Shirts For Men,4.0,7.0,49,1065,852,213,852.0,Other
755,Black Cotton Round Neck Half Sleeve Buddha Printed T-Shirt For Men,,,0,0,600,0,600.0,Other
756,Black Colour Round Neck Half Sleeve Printed Tshirt For Men,,,0,0,600,0,600.0,Other
757,Pack Of 3 Eye Printed 100% Cotton T-Shirt For Men-Blue/White/Maroon,,,0,0,1000,0,333.3333333333333,Other
758,Pack Of 3 Eye Printed 100% Cotton T-Shirt For Men-Maroon/Grey/Black,,,0,0,1000,0,333.3333333333333,Other
759,Pack Of 3 Plain 100% Cotton T-Shirt For Men- Maroon/Grey/Black,,,0,0,1200,0,400.0,Other
760,Pack Of 3 Eye Embroidered 100% Cotton T-Shirt For Men-Black/Green/Blue,,,0,0,1400,0,466.6666666666667,Other
761,Pack Of 3 Embroidered 100% Cotton T-Shirt For Men- Maroon/Green/Blue,,,0,0,1400,0,466.6666666666667,Other
762,Pack Of 3 Plain 100% Cotton T-Shirt For Men-Blue/Red/Green,,,0,0,1200,0,400.0,Other
763,Pack Of 3 Buddha Printed 100% Cotton T-Shirt For Men-Red/Grey/Black,,,0,0,1000,0,333.3333333333333,Other
764,Pack Of 3 Buddha Printed 100% Cotton T-Shirt For Men-Black/Red/Blue,,,0,0,1000,0,333.3333333333333,Other
765,Pack Of 3 Buddha Printed 100% Cotton T-Shirt For Men-Blue/Grey/Red,,,0,0,1000,0,333.3333333333333,Other
766,Pack Of 3 Mandala Printed 100% Cotton T-Shirt For Men-Black/Blue/Green - 023,,,0,0,1000,0,333.3333333333333,Other
767,Pack Of 3 Mandala Printed 100% Cotton T-Shirt For Men-Black/White/Blue - 023,,,0,0,1000,0,333.3333333333333,Other
768,Pack Of 3 Half Sleeve Printed 100% Cotton T-Shirt For Men-Green/White/Yellow,,,0,0,1000,0,333.3333333333333,Other
769,Pack Of 3 Buddha Printed 100% Cotton T-Shirt For Men-Black/Red/Green - 05,,,0,0,1000,0,333.3333333333333,Other
770,Pack Of 3 Buddha Printed 100% Cotton T-Shirt For Men-Black/Light Blue/Green - 05,,,0,0,1000,0,333.3333333333333,Other
771,Dark Green Solid Premium Round Neck Cotton T-Shirt For Men,,,0,1600,700,900,700.0,Other
772,Acknowledge Me Tshirt for Men,4.0,4.0,0,1065,852,213,852.0,Other
773,Marvin Regular Cotton T-Shirt for Men,4.6,14.0,57,1065,852,213,852.0,Other
774,Blue Cotton Round Neck Little Buddha Printed T-Shirt For Men,5.0,1.0,0,0,450,0,450.0,Other
775,Single Men's Short Sleeve White T-shirt,4.5,2.0,0,0,600,0,600.0,Other
776,Doro Blue Tactical Stretchy Plain T-shirt for Men,4.0,5.0,0,0,1085,0,1085.0,Doro
777,Men's Cotton Fabric Full T-Shirt For Summer,,,0,1299,899,400,899.0,Other
778,Blue Cotton Round Neck Mandala Printed T-Shirt For Men,,,0,0,450,0,450.0,Other
779,Black Batman Printed T-Shirt For Men,1.0,1.0,0,0,450,0,450.0,Other
780,Black Cotton Round Neck Mandala Embroidred T-Shirt For Men,5.0,1.0,0,0,600,0,600.0,Other
781,Binay Embroidery Black Casual Om Printed T-Shirt For Men - Fashion | T-Shirts For Men | Men's Upper Wear | T-Shirts |,4.8,5.0,65,0,450,0,450.0,Binay Embroidery
782,Blue Color Mix Cotton Round Neck Half Sleeves Plain T-Shirt For Men,,,0,0,650,0,650.0,Other
783,Men’s Three Bottom Cotton Kurta,,,0,699,499,200,499.0,Other
784,Nyptra Red Premium Muscle Fit Plain Cotton T-Shirt For Men - Fashion | T-Shirts For Men | Men's Wear |,5.0,1.0,0,1600,500,1100,500.0,nyptra
785,Maroon/Dark Blue Pure Cotton Round Neck Premium T-shirt For Men-Pack Of 2,4.4,8.0,0,0,1200,0,600.0,Other
786,Grey Shiva Printed T-Shirt For Men,3.6,9.0,51,0,349,0,349.0,Other
787,In The Darkness Written Game Of Thrones T-Shirt,2.3,3.0,0,0,650,0,650.0,Other
788,Grey Cotton Round Neck Half Sleeve Prayer Flag Printed T-Shirt For Men,,,0,0,600,0,600.0,Other
789,One Piece Printed 100% Cotton Tshirt For Men,4.7,15.0,78,600,379,221,379.0,Other
790,Iron Man Mens T-Shirt,4.0,1.0,0,0,850,0,850.0,Other
791,Oversized Soft Feel Combed Cotton T-Shirt For Men - Multicolor | Multisize | Fashion | T-Shirts For Men,3.3,4.0,32,899,749,150,749.0,Other
792,Pink Round Neck Plain 100% T-Shirt For Men,,,0,0,300,0,300.0,Other
793,Superman Logo Printed T-Shirt For Men,3.6,9.0,38,0,650,0,650.0,logo
794,Pack Of 3 Plain 100% Cotton T-Shirt For Men-Maroon/Red/Blue,,,0,1900,899,1001,299.6666666666667,Other
795,Black Color Round Neck Half Sleeves Plain T-Shirt For Men,,,0,0,1250,0,1250.0,Other
796,Tokyo Revengers Tshirt for Men,4.1,11.0,68,750,450,300,450.0,Other
797,White Mandala Round Neck 100% T-Shirt For Men - 023,,,0,0,350,0,350.0,Other
798,All In One Gallery - Dab Buddha Printed Cotton T-shirt For Men,4.0,1.0,0,0,350,0,350.0,Other
799,Mikasa Printed Tshirt for Men,4.0,5.0,0,750,450,300,450.0,Other
800,Combo Of 3 Cotton Tie Dye T-Shirt For Men- Multicolored,3.8,28.0,139,0,1500,0,500.0,Other
801,Maroon/Light Green Pure Cotton Round Neck Premium T-shirt For Men-Pack Of 2,5.0,4.0,0,0,1200,0,600.0,Other
802,Binay Embroidery White Hill Fire Printed T-Shirts For Men - Fashion | T-Shirts For Men | Men's Upper Wear | T-Shirts |,4.8,4.0,30,550,450,100,450.0,Binay Embroidery
803,Plain Half Sleeve 5 Pcs Combo T-Shirt For Men Summer Collection,4.8,4.0,33,0,1500,0,300.0,Other
804,Hills And Clouds & Echo Series T-Shirt For Men (Wear Your Mask) (White),,,0,799,519,280,519.0,Hills And Clouds
805,Black Cotton Round Neck Half Sleeve Bhairav Printed T-Shirt For Men's,,,0,0,400,0,400.0,Other
806,Nyptra Blue Premium Muscle Fit Plain Cotton T-Shirt For Men - Fashion | T-Shirts For Men | Men's Wear |,4.8,4.0,0,1600,500,1100,500.0,nyptra
807,Binay Embroidery Big Size Plain 3 pcs Combo T-Shirt For Men - Fashion | T-Shirts For Men | Men's Upper Wear | T-Shirts |,4.7,3.0,0,1500,1050,450,350.0,Binay Embroidery
808,Grey Buddha'S Eye Printed 100% Cotton T-Shirt For Men - 04,5.0,1.0,0,0,350,0,350.0,Other
809,Batman Splash Printed T-Shirt For Men,3.5,8.0,33,0,650,0,650.0,Other
810,UFC Plain Full T-Shirt with Cap for Men,5.0,1.0,0,0,1325,0,1325.0,Other
811,White Mandala Embroidered 100% T-Shirt For Men - 011,,,0,0,550,0,550.0,Other
812,Black Cotton Round Neck OM Printed T-Shirt For Men,,,0,0,450,0,450.0,Other
813,Pack Of 3 Ganesh Printed 100% Cotton T-Shirt For Men-Black/Grey/Green - 016,,,0,0,1000,0,333.3333333333333,Other
814,Brown V-Neck T-Shirt For Men,1.0,1.0,0,0,650,0,650.0,Other
815,Hills And Clouds & Graphic Series T-Shirt (I Am Satisfied) (Navy Blue) For Men,4.8,4.0,0,899,584,315,584.0,Hills And Clouds
816,Nyptra Orange Premium Muscle Fit Plain Cotton T-Shirt For Men - Fashion | T-Shirts For Men | Men's Wear |,,,0,1400,500,900,500.0,nyptra
817,Round Neck Solid Short Sleeves T-Shirts For Men - Green | Multisize | Fashion | Summer T-Shirts For Men,4.5,2.0,0,999,699,300,699.0,Other
818,Pink Floyd by Free Authority Navy Blue Tshirt for Men STY-19-20-002315,3.7,3.0,0,2097,899,1198,899.0,Other
819,Yellow Pure Cotton Plain T-Shirt/ Summer Wear For Men.,2.7,3.0,0,600,399,201,399.0,Other
820,Peaky Blinders Printed T-shirts For Men,,,0,0,750,0,750.0,Other
821,Nyptra Light Blue Solid Premium Muscle Fit Plain Cotton T-Shirt For Men - Fashion | T-Shirts For Men | Men's Wear |,5.0,1.0,0,1600,600,1000,600.0,nyptra
822,Red Embroidered 100% T-Shirt For Men,,,0,0,550,0,550.0,Other
823,Soft Cotton Zip Neck Design Full Sleeve Summer T-shirt For Men,5.0,1.0,0,1750,1299,451,1299.0,Other
824,Pack of 4 Anime Printed 100% Cotton Tshirt For Men ( Print may vary ),4.5,4.0,32,2000,1399,601,349.75,Other
825,Black Cotton Printed Half Sleeves T-Shirt For Men,5.0,1.0,0,1200,799,401,799.0,Other
826,Binay Embroidery Cotton Plain T-Shirt Set Of 3 Pcs Combo For Men - Fashion | T-Shirts For Men | Men's Upper Wear | T-Shirts |,,,0,1050,899,151,299.6666666666667,Binay Embroidery
827,Pack Of 3 Plain 100% Cotton T-Shirt For Men- Green/White/Maroon,,,0,1900,899,1001,299.6666666666667,Other
828,Binay Embroidery Cotton Plain Casual T-Shirt 3 Pcs Combo Set For Men - Fashion | T-Shirts For Men | Men's Upper Wear | T-Shirts |,,,0,1050,899,151,299.6666666666667,Binay Embroidery
829,Black Color Poly Cotton Half Sleeves ANTF Printed T-Shirt For Men,1.0,1.0,0,563,375,188,375.0,Other
830,Maroon Cotton Round Neck Little Buddha Printed T-Shirt For Men,5.0,1.0,0,0,450,0,450.0,Other
831,White Color Anime Printed T-Shirt For Men,,,0,0,360,0,360.0,Other
832,Doro Mint Tactical Stretchy Plain T-Shirt For Men - Mint | Multisize | Fashion | Summer T-Shirts For Men,4.4,5.0,0,0,1085,0,1085.0,Doro
833,Pack of 2 Anime Printed 100% Cotton Tshirt For Men ( Color may vary ),4.7,18.0,91,1200,899,301,449.5,Other
834,Levi Tshirt for Men,,,0,750,450,300,450.0,Other
835,Grey Cotton Round Mandala Embroidered T-Shirt For Men,5.0,1.0,0,0,650,0,650.0,Other
836,Skull Men T-Shirt,5.0,3.0,0,0,850,0,850.0,Other
837,Multicolor Cotton Round Neck Tie-Dye Printed T-Shirt For Men,3.0,1.0,0,0,450,0,450.0,Other
838,Binay Embroidery Black Casual Vairab Printed T-Shirt For Men - Fashion | T-Shirts For Men | Men's Upper Wear | T-Shirts |,2.0,1.0,0,599,499,100,499.0,Binay Embroidery
839,Nyptra Light Grey Premium Muscle Fit Plain Cotton T-Shirt For Men - Fashion | T-Shirts For Men | Men's Wear |,4.2,5.0,38,1600,600,1000,600.0,nyptra
840,Half Sleeve Cotton Soft T-Shirt For Men,4.3,6.0,0,990,299,691,299.0,Other
841,Pack Of 3 Plain 100% Cotton T-Shirt For Men-Blue/Red/Black,,,0,1900,899,1001,299.6666666666667,Other
842,Pack Of 3 Plain 100% Cotton T-Shirt For Men-Pink/Sky Blue/Orange,,,0,1900,899,1001,299.6666666666667,Other
843,Pack Of 3 Plain 100% Cotton T-Shirt For Men- Maroon/Grey/Black,,,0,1900,899,1001,299.6666666666667,Other
844,Pack Of 3 Plain 100% Cotton T-Shirt For Men-Black/White/Blue,,,0,1900,899,1001,299.6666666666667,Other
845,Pack Of 3 Plain 100% Cotton T-Shirt For Men-Grey/White/Red,,,0,1500,899,601,299.6666666666667,Other
846,Pack Of 3 Plain 100% Cotton T-Shirt For Men-Red/Grey/Blue,,,0,1900,899,1001,299.6666666666667,Other
847,Pack Of 3 Plain 100% Cotton T-Shirt For Men-Red/White/Blue,,,0,1900,899,1001,299.6666666666667,Other
848,Pack Of 3 Plain 100% Cotton T-Shirt For Men- Maroon/White/Black,,,0,1900,899,1001,299.6666666666667,Other
849,Light Yellow Pure Cotton Plain T-Shirt/ Summer Wear For Men.,,,0,600,399,201,399.0,Other
850,Pack Of 4 Round Neck Plain Tshirt For Men,,,0,2000,1399,601,349.75,Other
851,Katsuki Bakugo Printed Tshirt for Men,4.9,17.0,97,750,450,300,450.0,Other
852,Pack Of 3 Buddha Printed 100% Cotton T-Shirt For Men-Green/Maroon/Blue - 019,5.0,1.0,0,0,1000,0,333.3333333333333,Other
853,Binay Embroidery Black Printed T-Shirt For Men - Fashion | T-Shirts For Men | Men's Upper Wear | T-Shirts |,4.8,4.0,0,0,450,0,450.0,Binay Embroidery
854,ONN Men Round Neck Half Sleeve T-shirt - Fashion | T-Shirts For Men | Men's Wear | Half Sleeve T-Shirts |,,,0,0,1195,0,1195.0,Other
855,Printed Loose Graffiti Half Sleeve Street Wear T Shirt For Men,,,0,1900,1200,700,1200.0,Other
856,Cream Cotton Round Neck Half Sleeve Plain T-Shirt For Men,,,0,0,800,0,800.0,Other
857,Hills And Clouds & Graphic Series T-Shirt [Aham Bramasmi (Skull)] {Grey} For Men,5.0,1.0,0,899,584,315,584.0,Hills And Clouds
858,Black Casual Printed T-Shirt For Men,,,0,0,650,0,650.0,Other
859,White Flag Printed 100% Cotton T-Shirt For Men,,,0,0,350,0,350.0,Other
860,Two Wheels Biker Combed Cotton Tshirt for Men,5.0,5.0,0,1065,852,213,852.0,Other
861,Think Outside The Box Printed T-Shirt For Men,3.5,6.0,0,449,399,50,399.0,Other
862,Black Solid Muscle Fit Cotton T-Shirt For Men,,,0,1000,775,225,775.0,Other
863,Grey T-Shirt For Men - Multisize | Fashion | Short Sleeves T-Shirts For Men | Men's Wear | T-Shirts |,,,0,0,1450,0,1450.0,Other
864,Binay Embroidery Black/White Embroidered T-Shirt For Men - Fashion | T-Shirts For Men | Men's Upper Wear | T-Shirts |,4.0,1.0,0,0,450,0,450.0,Binay Embroidery
865,Naruto Printed 100% Cotton Tshirt For Men,4.5,17.0,139,600,425,175,425.0,Other
866,Maroon Round Neck Plain 100% T-Shirt For Men,5.0,1.0,0,0,300,0,300.0,Other
867,Men Band Collar Button Loop T-shirt,,,0,0,1575,0,1575.0,Other
868,White Cotton T-Shirt For Men,,,0,0,1000,0,1000.0,Other
869,Cream Cotton T-Shirt For Men,,,0,0,1000,0,1000.0,Other
870,Binay Embroidery Beatles Grey Printed T-Shirt For Men - Fashion | T-Shirts For Men | Men's Upper Wear | T-Shirts |,4.7,3.0,0,0,349,0,349.0,Binay Embroidery
871,Tshirt - Light Cotton Light Blue (R-Neck),,,0,0,1200,0,1200.0,Other
872,Black Cotton Round Neck Buddha Nepal Printed T-Shirt For Men,,,0,0,450,0,450.0,Other
873,Maroon/White Pure Cotton Round Neck Premium T-shirt For Men-Pack Of 2,,,0,1200,949,251,474.5,Other
874,Pack of 2 Anime Printed 100% Cotton Tshirt For Men ( Color may vary ),4.5,2.0,0,1200,899,301,449.5,Other
875,Red Cotton Round Neck Buddha Nepal Printed T-Shirt For Men,,,0,0,450,0,450.0,Other
876,Binay Embroidery Black Printed Combo T-Shirt For Men- 2 Pcs - Fashion | T-Shirts For Men | Men's Upper Wear | T-Shirts |,4.0,6.0,57,0,900,0,450.0,Binay Embroidery
877,Addiz Sports Solid T-Shirt for Men (VS001),3.3,4.0,0,0,499,0,499.0,Other
878,Zamz Eco Cotton T-Shirt For Men,,,0,999,499,500,499.0,zamz
879,Maroon Buddha Printed T-Shirt For Men,5.0,3.0,0,0,470,0,470.0,Other
880,Binay Embroidery White Printed T-Shirt For Men - Fashion | T-Shirts For Men | Men's Upper Wear | T-Shirts |,4.5,12.0,59,0,450,0,450.0,Binay Embroidery
881,Navy PINK FLOYD THE WALL Printed T-Shirt For Men,,,0,0,370,0,370.0,Other
882,Black Plain T-Shirt For Men,3.5,2.0,0,0,330,0,330.0,Other
883,Hills And Clouds & Graphic Series T-Shirt [Aham Bramasmi (Skull)] {Navy Blue} For Men,5.0,1.0,0,899,584,315,584.0,Hills And Clouds
885,Black V-Neck Lycra T-Shirt For Men,,,0,0,650,0,650.0,Other
886,Doro White Tactical Stretchy Plain T-shirt for Men,4.0,6.0,0,0,1085,0,1085.0,Doro
887,Combo Pack 4 Plain Cotton T-shirt/Genuine Nepal Made Product,4.0,4.0,0,0,1350,0,337.5,Other
888,Doro Black Cotton Round Neck Half Sleeve Side Printed T-Shirt For Men,5.0,3.0,0,0,975,0,975.0,Doro
889,Black Color Cotton Round Neck Half Sleeve Plain Oversized / Baggy T-Shirt For Men,,,0,0,850,0,850.0,Other
890,White/Black Cotton Round Neck Sleeveless Printed T-Shirt For Men,4.0,1.0,0,0,900,0,900.0,Other
891,Plain Cotton T-Shirt For Men Blue,3.0,1.0,0,500,350,150,350.0,Other
892,White Cotton Round Neck Mandala Embroidred T-Shirt For Men,,,0,0,650,0,650.0,Other
893,CR7 Golden Printed T-shirt for Men,,,0,700,600,100,600.0,Other
894,Navy Buddha Face Printed T-Shirt For Men,,,0,0,370,0,370.0,Other
895,Light Blue Oxemberg Printed Cotton T-shirt For Men,5.0,1.0,0,0,1699,0,1699.0,oxemberg
896,Binay Embroidery Printed Spider/Superman T-Shirts For Men - Fashion | T-Shirts For Men | Men's Upper Wear | T-Shirts |,4.0,1.0,0,555,411,144,411.0,Binay Embroidery
897,Pack Of 3 Plain 100% Cotton T-Shirt For Men- Maroon/White/Black,5.0,2.0,0,0,1125,0,375.0,Other
898,Men'S Baggy Oversize Vintage Summer T-Shirt For Men - Multicolor | Multisize | Fashion | T-Shirts For Men,4.3,21.0,171,600,399,201,399.0,Other
899,All In One Gallery - Side Buddha Printed Cotton T-shirt For Men,4.0,1.0,0,0,350,0,350.0,Other
900,Green Cotton Round Neck Half Sleeve Plain T-Shirt For Men,,,0,0,500,0,500.0,Other
901,Vincent Clothing Blue Color Cotton Layered Sleeve Round Neck Plain Full Sleeve T-Shirt For Men,5.0,1.0,0,1890,1795,95,1795.0,Other
902,White and Black Cotton Round Neck Half Sleeve Printed T-Shirt For Men,,,0,0,800,0,800.0,Other
903,Yuva Clothing's Black Cotton Applecut Round Neck Half Sleeve T-Shirt For Men,4.0,1.0,0,750,500,250,500.0,Other
904,Batman Facemask Printed T-Shirt For Men,3.0,1.0,0,0,650,0,650.0,Other
905,Vantuff Blue Premium Polyester Gradient Dry Fit Lightweight T-shirt For Men,,,0,1425,995,430,995.0,Other
906,Binay Embroidery Batman Printed T-Shirt For Men - Fashion | T-Shirts For Men | Men's Upper Wear | T-Shirts |,4.3,12.0,77,0,450,0,450.0,Binay Embroidery
907,Dark Blue Embroidery Round Neck 100% T-Shirt For Men,,,0,0,550,0,550.0,Other
908,White Mandala Printed 100% T-Shirt For Men - 023,,,0,0,350,0,350.0,Other
909,Black Round Neck Plain 100% T-Shirt For Men,,,0,0,300,0,300.0,Other
910,Pubg Squad Printed T-Shirt For Men,5.0,2.0,0,0,650,0,650.0,Other
911,Philadelphia 76ers Combed Cotton Tshirt for Men,4.5,4.0,0,1065,852,213,852.0,Other
912,Binay Embroidery Black Work Hard Printed T-Shirt For Men - Fashion | T-Shirts For Men | Men's Upper Wear | T-Shirts |,3.6,10.0,74,0,450,0,450.0,Binay Embroidery
913,Dark Brown/Ivory Yellow Color Round Neck Half Sleeves Plain Design T-Shirt For Men Set Of 2,,,0,0,1400,0,1400.0,Other
914,Maroon Color Premium Cotton Round Neck Half Sleeves Aiiihh Printed Graphic T-shirt For Men,5.0,1.0,0,0,1490,0,1490.0,Other
915,Black And White Color Premium Cotton Round Neck Full Sleeves T-shirt For Men,5.0,1.0,0,0,1890,0,1890.0,Other
916,White Cotton Round Neck Little Buddha Printed T-Shirt For Men,5.0,1.0,0,0,450,0,450.0,Other
917,Pack Of 3 Plain 100% Cotton T-Shirt For Men- Blue/Grey/Black,4.3,4.0,0,0,1125,0,375.0,Other
918,Cream Cotton Round Neck Half Sleeve Plain T-Shirt For Men,5.0,1.0,0,0,900,0,900.0,Other
919,Full Sleeves Blue Buddha Printed Casual Cotton T-Shirt For Men,4.3,6.0,0,0,700,0,700.0,Other
920,Pink Cotton Round Neck Half Sleeve Plain T-Shirt For Men,,,0,0,500,0,500.0,Other
921,Binay Embroidery Black Casual Printed T-Shirt For Men - Fashion | T-Shirts For Men | Men's Upper Wear | T-Shirts |,5.0,4.0,54,0,450,0,450.0,Binay Embroidery
922,Orange Color T-Shirt For Men,4.0,2.0,0,500,399,101,399.0,Other
923,"Livingtex 3 Pcs T-Shirt For Men/ White, Short Sleeve, Pure Cotton, Round Neck T-Shirt For Men",,,0,1500,1050,450,350.0,livingtex
924,Navy Blue Cotton Solid Premium Round Neck T-Shirt For Men,3.3,3.0,0,1600,700,900,700.0,Other
925,Dc Comics by Free Authority Red Tshirt for Men DC0GMT204,5.0,1.0,0,1797,899,898,899.0,Other
926,Combo Pack Of 3 Cotton T-shirt Genuine Nepal Made Product For Better Looks,,,0,0,1200,0,400.0,Other
927,Black Sport T-Shirt For Men - Multisize | Fashion | T-Shirts For Men | Men's Wear | Men's Sport T-Shirts |,3.8,6.0,0,2000,999,1001,999.0,Other
928,Black Cotton Round Neck Half Sleeve Newari Mandala Printed T-Shirt For Men's,,,0,0,400,0,400.0,Other
929,Black Cotton Gorkhali Printed T-Shirt For Men,4.5,2.0,43,0,450,0,450.0,Other
930,Binay Embroidery Cotton Black Full Sleeve Black Sabbath Printed T-Shirt For Men - Fashion | T-Shirts For Men | Men's Upper Wear | T-Shirts |,4.3,11.0,52,750,550,200,550.0,Binay Embroidery
931,Gym And Tonic Regular Cotton T-Shirt For Men,3.5,8.0,61,1065,852,213,852.0,Other
932,Pubg Winner Winner Chicken Dinner T-Shirt For Men,,,0,0,600,0,600.0,Other
933,Blue Color Premium Cotton Round Neck Half Sleeves Therapy Printed T-shirt For Men,5.0,1.0,0,0,1490,0,1490.0,Other
934,Purple Solid Plain Round Neck Cotton T-Shirt For Men,,,0,1600,700,900,700.0,Other
935,Premium Quality Round Neck Tees For Summer - Fashion | T-Shirts For Men | Men's Wear | Men's T-Shirts |,3.5,2.0,0,1299,844,455,844.0,Other
936,Printed Rock And Roll T-Shirt For Men - Fashion | T-Shirts For Men | Men's Wear | Men's Printed T-Shirts |,4.2,5.0,40,999,699,300,699.0,Other
937,Plain T-Shirt Deep Green Color For summer.,3.5,2.0,0,1200,399,801,399.0,Other
938,Pubg Printed T-Shirt For Men,3.0,1.0,0,0,650,0,650.0,Other
939,Maroon Hypnotic Printed T-Shirt For Men,5.0,1.0,0,0,750,0,750.0,Other
940,Kilometer Full Sleeve T-Shirt For Men KM1005,3.8,10.0,39,0,1850,0,1850.0,kilometer
941,Men’s Gym Wear T-shirt,,,0,0,1700,0,1700.0,Other
942,Lakhey Premium Cotton Tshirt for Men,4.3,3.0,0,1065,852,213,852.0,Other
943,Plain T-shirt for Men,3.5,6.0,75,0,400,0,400.0,Other
944,Blue V Neck Plain T-Shirt For Men - Multisize | Fashion | Short Sleeves T-Shirts For Men | Men's Wear | T-Shirts |,1.0,1.0,0,0,1450,0,1450.0,Other
945,PIAZZAITALIA Printed T-Shirt For Men - 26145,4.4,5.0,0,0,1250,0,1250.0,piazzaitalia
946,PIAZZAITALIA Printed T-Shirt For Men - 26145,4.0,1.0,0,0,1250,0,1250.0,piazzaitalia
947,White Cotton Round Neck Buddha Eyes Printed T-Shirt For Men,,,0,0,450,0,450.0,Other
948,Grey Cotton Round Neck Mandala Printed T-Shirt For Men,5.0,2.0,0,0,450,0,450.0,Other
949,Black Round Vest For Men,4.1,18.0,127,0,799,0,799.0,Other
950,Vantuff Green Premium Polyester Gradient Dry Fit Lightweight T-shirt For Men,3.5,2.0,0,1425,995,430,995.0,Other
951,Binay Embroidery Red Casual T-Shirt For Men - Fashion | T-Shirts For Men | Men's Upper Wear | T-Shirts |,4.6,5.0,0,450,399,51,399.0,Binay Embroidery
952,Combo Set Round Neck Cotton T-Shirt Set For Men - Multicolor | Multisize | Fashion | T-Shirts For Men,5.0,5.0,0,1995,1090,905,1090.0,Other
953,100% Cotton Plain Tshirt,5.0,2.0,0,0,300,0,300.0,Other
954,Binay Embroidery Black/Grey Superman Printed T-Shirt For Men - Fashion | T-Shirts For Men | Men's Upper Wear | T-Shirts |,4.3,14.0,85,0,400,0,400.0,Binay Embroidery
955,Axl Rose Combed Cotton Tshirt for Men,5.0,1.0,0,1065,852,213,852.0,Other
956,Sea Green Color Soft Cotton Zip Neck Design Full Sleeve Summer T-shirt For Men,4.7,3.0,0,1750,1299,451,1299.0,Other
957,Binay Embroidery Nepali Cotton Printed T-Shirt For Men - Fashion | T-Shirts For Men | Men's Upper Wear | T-Shirts |,4.4,10.0,92,0,400,0,400.0,Binay Embroidery
958,Hills And Clouds & Kathmandu Map T-Shirt (Navy Blue) For Men,4.5,10.0,0,1200,780,420,780.0,Hills And Clouds
959,Binay Embroidery Black Casual Shiva G Printed T-Shirt For Men - Fashion | T-Shirts For Men | Men's Upper Wear | T-Shirts |,4.6,9.0,87,0,450,0,450.0,Binay Embroidery
960,Kilometer Round Neck Sweat T-Shirt Os 103,4.5,12.0,33,0,2850,0,2850.0,kilometer
961,Itachi Men Cotton T-Shirt,,,0,0,850,0,850.0,Other
962,Maroon Prayer Flag Printed T-Shirt For Men,,,0,0,370,0,370.0,Other
963,Avenger Endgame Logo Printed T-Shirt For Men,4.2,29.0,342,0,750,0,750.0,logo
964,Fine Multicolor Printed Mandala T-shirt for Men,4.0,2.0,0,0,650,0,650.0,Other
965,Sky Blue Round Neck Half Sleeve Plain T-Shirt For Men,3.0,1.0,0,0,300,0,300.0,Other
966,Black Casual Cotton Printed T-Shirt For Men,5.0,1.0,42,0,450,0,450.0,Other
967,Binay Embroidery Black Casual Nepali Quoits Printed T-Shirt For Men - Fashion | T-Shirts For Men | Men's Upper Wear | T-Shirts |,5.0,1.0,52,0,450,0,450.0,Binay Embroidery
968,Men 3pcs Round Neck Solid T-shirts,3.9,13.0,46,2999,1199,1800,1199.0,Other
969,"Livingtex T-Shirt For Men/ White, Short Sleeve, Pure Cotton, Round Neck T-Shirt For Men",4.0,6.0,44,480,349,131,349.0,livingtex
970,Green PUBG Printed T-Shirt For Men,,,0,0,650,0,650.0,Other
971,Black Momo Printed Round Neck T-Shirt For Men,,,0,0,650,0,650.0,Other
