,product_name,ratings,no_of_ratings,sold_num,original_price,current_price,discount_amount,price_of_1,brand_name
2504,Police F535 Bodysize Round Neck Cotton T-Shirt - White,,,0,0,1799,0,1799.0,police
2505,Calendar Got Printed T-Shirt,5.0,1.0,0,0,500,0,500.0,Other
2506,Personalized T-shirts or Printed for a Unique Gift,,,0,0,600,0,600.0,Other
2508,Grey/Black Temple Design Cotton T-Shirt For Men,,,0,0,650,0,650.0,Other
2509,Pack Of 3 Half Sleeve Printed 100% Cotton T-Shirt For Men-Light Blue/White/Green,,,0,0,1000,0,333.3333333333333,Other
2510,Pubg Skull Head Winner Printed T-Shirt For Men,,,0,0,650,0,650.0,Other
2511,Maroon Pubg Printed T-Shirt For Men,,,0,0,650,0,650.0,Other
2512,Light Blue Color Printed Design Round Neck Half Sleeves T-Shirt For Men,,,0,0,1500,0,1500.0,Other
2513,Cotton Half T-Shirt For Men,,,0,1800,1250,550,1250.0,Other
2514,Endgame Now Golden Printed T-Shirt For Men,3.5,2.0,0,0,750,0,750.0,Other
2515,Chiya Churot Printed T-shirts For Men,,,0,0,750,0,750.0,Other
2516,Pubg Hen Helmet Printed T-Shirt For Men,5.0,1.0,0,0,650,0,650.0,Other
2517,White 100% Cotton Roar Printed T-Shirt For Men,,,0,0,650,0,650.0,Other
2518,Blue Cotton Round Neck Half Sleeve Tie-Dye Printed T-Shirt For Men,,,0,0,700,0,700.0,Other
2521,White Colour Round Neck Half Sleeve Buddha Printed Tshirt For Men,,,0,0,600,0,600.0,Other
2522,Green Cotton Round Neck Half Sleeve Newari Mandala Printed T-Shirt For Men's,,,0,0,400,0,400.0,Other
2523,Green Color Soft Cotton Zip Neck Design Full Sleeve Summer T-shirt For Men,,,0,1750,1299,451,1299.0,Other
2525,Plain Cotton Casual Combo Set Of 3 T-Shirt For Men,,,0,1050,899,151,299.6666666666667,Other
2526,High Class V-neck Elegant Fashion Korean Knitted T-shirt For Men,,,0,3500,2200,1300,2200.0,Other
2527,Save the Drama Tshirt for Men,,,0,1065,852,213,852.0,Other
2528,Melange Grey V-Neck T-Shirt For Men,1.0,1.0,0,0,650,0,650.0,Other
2530,The Rock Printed T-Shirt For Men,,,0,0,650,0,650.0,Other
2531,Pack Of 3 Embroidered 100% Cotton T-Shirt For Men-Blue/Sky Blue/Maroon,,,0,0,1400,0,466.6666666666667,Other
2532,Brown Abstract Printed T-Shirt For Men,,,0,0,520,0,520.0,Other
2533,Red Abstract Printed T-Shirt For Men,,,0,0,520,0,520.0,Other
2534,Mint Green Abstract Printed T-Shirt For Men,,,0,0,520,0,520.0,Other
2535,Navy Printed T-Shirt For Men,,,0,0,590,0,590.0,Other
2536,Green Lane 40 Printed T-Shirt For Men,,,0,0,570,0,570.0,Other
2537,Black Moniey Embroidered T-Shirt For Men,,,0,0,615,0,615.0,Other
2538,Light Blue Abstarct Printed T-Shirt For Men,,,0,0,520,0,520.0,Other
2539,Red A Members Embroidered T-Shirt For Men,,,0,0,615,0,615.0,Other
2540,Black Abstarct Embroidered T-Shirt For Men,,,0,0,590,0,590.0,Other
2541,Mustard Yellow Abstarct Printed T-Shirt For Men,,,0,0,520,0,520.0,Other
2542,Purple Abstract Printed T-Shirt For Men,,,0,0,570,0,570.0,Other
2543,Forest Green Abstract Printed T-Shirt For Men,,,0,0,520,0,520.0,Other
2544,Chocolate Brown A Members Embroidered T-Shirt For Men,,,0,0,615,0,615.0,Other
2545,Yellow D&D Printed T-Shirt For Men,,,0,0,590,0,590.0,Other
2546,Brown Moniey Embroidered T-Shirt For Men,,,0,0,615,0,615.0,Other
2547,Green A Members Embroidered T-Shirt For Men,,,0,0,615,0,615.0,Other
2548,Red Passionate Embroidered T-Shirt For Men,,,0,0,615,0,615.0,Other
2549,Black A Members Embroidered T-Shirt For Men,,,0,0,615,0,615.0,Other
2550,Navy A Members Embroidered T-Shirt For Men,,,0,0,615,0,615.0,Other
2551,Red Fly Printed T-Shirt For Men,,,0,0,590,0,590.0,Other
2552,Pale Yellow Moniey Embroidered T-Shirt For Men,,,0,0,615,0,615.0,Other
2553,Pink Sunglesses Printed T-Shirt For Men,,,0,0,590,0,590.0,Other
2554,Yellow Zhen Chauan Fashion Printed T-Shirt For Men,,,0,0,520,0,520.0,Other
2555,Red Horse Printed T-Shirt For Men,,,0,0,570,0,570.0,Other
2556,Green Abstarct Printed T-Shirt For Men,,,0,0,520,0,520.0,Other
2557,Black Printed T-Shirt For Men,,,0,0,690,0,690.0,Other
2558,Maroon 100% Cotton Spain Printed T-Shirt For Men,,,0,0,600,0,600.0,Other
2559,Pack Of 3 Embroidered 100% T-Shirt For Men- Maroon/Green/Blue,,,0,0,1400,0,466.6666666666667,Other
2561,Round Neck Half Soft T-shirt For Men,,,0,0,700,0,700.0,Other
2562,Green World Cup 2018 Countries Printed T-Shirt For Men,,,0,0,550,0,550.0,Other
2563,Yellow Half Sleeve Collor Neck Tshirt For Men,,,0,0,999,0,999.0,Other
2564,Game Of Thrones -Lannister Spray T Shirt- Black,,,0,0,650,0,650.0,Other
2565,Black Printed 100% T-Shirt For Men,,,0,0,350,0,350.0,Other
2566,Royal Instinct Sky blue Supersoft Musclefit Premium Triblend Stretchable Loopnet Full Sleeve Sweatshirt For Men,,,0,0,1499,0,1499.0,Other
2567,Grey Embroidered 100% T-Shirt For Men,,,0,0,550,0,550.0,Other
2568,Mickey & Friends by Free Authority Blue Tshirt for Men STY-18-19-005768,,,0,1797,1299,498,1299.0,Other
2569,Metallica Face Printsed Tshirt For Men,3.3,4.0,0,0,650,0,650.0,Other
2570,Bossini Crew Neck Short Sleeves Regular Solid Tee For Men,3.5,2.0,0,0,1582,0,1582.0,Bossini
2572,Black Half Sleeves Printed 100% T-Shirt For Men,,,0,0,350,0,350.0,Other
2573,White Buddha Printed Round Neck 100% T-Shirt For Men,,,0,0,350,0,350.0,Other
2574,Grey Half Sleeves Printed 100% T-Shirt For Men,,,0,0,350,0,350.0,Other
2575,Black Ganesha Printed 100% T-Shirt For Men - 017,,,0,0,350,0,350.0,Other
2576,Maroon Half Sleeves Printed 100% T-Shirt For Men,,,0,0,350,0,350.0,Other
2577,Yellow Buddha's Eye Printed 100% T-Shirt For Men - 04,,,0,0,350,0,350.0,Other
2578,Black Buddha's Eye Printed 100% T-Shirt For Men - 04,,,0,0,350,0,350.0,Other
2579,Royal Blue Pure Cotton Plain T-Shirt/ Summer Wear For Men.,,,0,600,399,201,399.0,Other
2580,Pack of 2 Eye Bird Printed T-Shirt For Men,,,0,0,1000,0,500.0,Other
2581,Oversized T-Shirt For Men,,,0,849,749,100,749.0,Other
2583,Money Heist Character Printed T-Shirt For Men,,,0,0,650,0,650.0,Other
2584,Police Fc029 Bodysize Full Sleeves T-Shirt - Yellow,,,0,0,1799,0,1799.0,police
2585,Police Bc020 Big Size Round Neck T-Shirt For Men- Red,,,0,0,1955,0,1955.0,police
2587,Navy Blue Oversized T-Shirt For Men,,,0,899,799,100,799.0,Other
2588,ONN Men V Neck Sports Green Half Sleeve T-shirt - Fashion | T-Shirts For Men | Half-Sleeves T-Shirts |,,,0,0,1195,0,1195.0,Other
2589,Maroon Pubg Printed T-Shirt For Men,5.0,1.0,0,0,650,0,650.0,Other
2590,Maroon 'Dari Baba' Printed T-Shirt For Men,,,0,0,650,0,650.0,Other
2591,Black Color Premium Cotton Round Neck Half Sleeves Zzz Printed Graphic T-shirt For Men,,,0,0,1490,0,1490.0,Other
2592,Green Cotton Front Button Side Pocket Design Hlaf Sleeve Tops For Men,,,0,0,790,0,790.0,Other
2593,Police F545 Bodysize Round Neck Cotton T-Shirt - Grey,,,0,0,1699,0,1699.0,police
2594,My Lord Printed Casual T-Shirt For Men,,,0,0,599,0,599.0,Other
2595,Pepe Jeans Men Coral Pink & White Slim Fit Striped Round Neck T-Shirt,,,0,0,2898,0,2898.0,pepe jeans
2596,Men Plain Cotton Tshirt for Summer,5.0,1.0,0,0,1150,0,1150.0,Other
2597,White Cotton Round Neck Half Sleeve Prayer Flag Printed T-Shirt For Men's,,,0,0,400,0,400.0,Other
2598,Maroon Cotton Round Neck Half Sleeve Prayer Flag Printed T-Shirt For Men's,,,0,0,400,0,400.0,Other
2599,Green Cotton Round Neck Half Sleeve Magic Budhha Printed T-Shirt For Men's,,,0,0,400,0,400.0,Other
2600,Black Cotton Round Neck Half Sleeve Golden Mandala Printed T-Shirt For Men's,,,0,0,400,0,400.0,Other
2601,Green Cotton Round Neck Half Sleeve Prayer Flag Printed T-Shirt For Men's,,,0,0,400,0,400.0,Other
2602,Red Cotton Round Neck Half Sleeve Colorfull Buddha Eye Printed T-Shirt For Men's,,,0,0,400,0,400.0,Other
2603,Maroon Cotton Round Neck Half Sleeve Golden Mandala Printed T-Shirt For Men's,,,0,0,400,0,400.0,Other
2604,Grey Cotton Round Neck Half Sleeve Buddha Printed T-Shirt For Men's,,,0,0,400,0,400.0,Other
2605,Blue Cotton Round Neck Half Sleeve Magic Budhha Printed T-Shirt For Men's,,,0,0,400,0,400.0,Other
2606,Red Cotton Round Neck Half Sleeve Prayer Flag Printed T-Shirt For Men's,,,0,0,400,0,400.0,Other
2607,Blue Cotton Round Neck Half Sleeve Bhairav Printed T-Shirt For Men's,,,0,0,400,0,400.0,Other
2609,Maroon Round Neck Half Sleeve Prayer Flag Printed T-Shirt For Men,,,0,0,400,0,400.0,Other
2610,Black Round Neck Half Sleeve Bhairav Printed T-Shirt For Men,,,0,0,400,0,400.0,Other
2611,Blue Round Neck Half Sleeve Printed T-Shirt For Men,,,0,0,400,0,400.0,Other
2615,Blue Round Neck Half Sleeve Golden Mandala Printed T-Shirt For Men,,,0,0,400,0,400.0,Other
2616,Pink Round Neck Half Sleeve Prayer Flag Printed T-Shirt For Men,,,0,0,400,0,400.0,Other
2617,Green Round Neck Half Sleeve Prayer Flag Printed T-Shirt For Men,,,0,0,400,0,400.0,Other
2619,Red Round Neck Half Sleeve Colorful Buddha Eye Printed T-Shirt For Men,,,0,0,400,0,400.0,Other
2620,Black Mandala Printed 100% T-Shirt For Men - 03,,,0,0,400,0,400.0,Other
2621,White Round Neck Half Sleeve Buddha Stupa Printed T-Shirt For Men,,,0,0,400,0,400.0,Other
2622,Grey Round Neck Half Sleeve Bhairav Printed T-Shirt For Men,,,0,0,400,0,400.0,Other
2623,Navy Blue 'Om Ma Ni Padhme Hum' Printed 100% T-Shirt For Men,,,0,0,400,0,400.0,Other
2625,Grey Round Neck Half Sleeve Nepal Flag Printed T-Shirt For Men,,,0,0,400,0,400.0,Other
2627,Maroon Buddha's Eye Printed 100% T-Shirt For Men - 04,,,0,0,400,0,400.0,Other
2628,Black 'Om Ma Ni Padhme Hum' Printed 100% T-Shirt For Men,,,0,0,400,0,400.0,Other
2629,Grey' Om Ma Ni Padhme Hum' Printed 100% T-Shirt For Men,,,0,0,400,0,400.0,Other
2630,Blue/Brown Round Neck 100% Tie Dye T-Shirt For Men,,,0,0,400,0,400.0,Other
2631,Green Round Neck Half Sleeve Golden Mandala Printed T-Shirt For Men,,,0,0,400,0,400.0,Other
2632,Maroon Round Neck Half Sleeve Golden Mandala Printed T-Shirt For Men,,,0,0,400,0,400.0,Other
2634,Maroon 'Om Ma Ni Padhme Hum' Printed 100% T-Shirt For Men,,,0,0,400,0,400.0,Other
2635,Cotton Dragon Printed T-Shirt For Men,,,0,0,750,0,750.0,Other
2636,White Everest Printed Round Neck T-Shirt For Men,,,0,0,650,0,650.0,Other
2637,Blackish Grey Dirt Printed Round Neck T-Shirt For Men,4.5,6.0,0,0,900,0,900.0,Other
2638,White Mandala Printed Half Sleeve T-Shirt for Men,,,0,0,350,0,350.0,Other
2639,Soft Green Half Sleeve Collor Neck Tshirt For Men,,,0,0,999,0,999.0,Other
2640,Police F544 Bodysize Round Neck Cotton T-Shirt - Grey,,,0,0,1699,0,1699.0,police
2641,Light Green And Blue Color Premium Cotton Round Neck Half Sleeves Graphic T-shirt For Men,,,0,0,1490,0,1490.0,Other
2642,Joker Themes Print T-Shirt For Men,,,0,0,650,0,650.0,Other
2643,Shazan Font Written Printed T-Shirt For Men,,,0,0,650,0,650.0,Other
2644,Black/Yellow Dragon Ball-Z Single Character Printed T-Shirt For Men,,,0,0,650,0,650.0,Other
2645,Anime Printed Black Cotton T-Shirt For Men,,,0,450,390,60,390.0,Other
2646,White Bhairab Printed T-Shirt For Men,5.0,1.0,0,0,750,0,750.0,Other
2647,Anime Printed (Deathnote) T-Shirt For Men,,,0,499,411,88,411.0,Other
2648,PUBG T-Shirt- Unisex,,,0,0,799,0,799.0,Other
2649,White 'Bouddha' Printed Cotton T-Shirt For Men,,,0,0,650,0,650.0,Other
2650,Men's Oversized Represent Printed Summer Top,,,0,1590,850,740,850.0,Other
2652,Pink Floyd by Free Authority Black Tshirt for Men STY-20-21-003969,,,0,2097,899,1198,899.0,Other
2653,PIAZZAITALIA Empower Up Printed T-Shirt For Men - 27297,5.0,2.0,0,0,2050,0,2050.0,piazzaitalia
2654,Black Bhairab Printed T-Shirt For Men,,,0,0,750,0,750.0,Other
2655,Green Cotton Round Neck Half Sleeve Tie-Dye Printed T-Shirt For Men's,,,0,0,600,0,600.0,Other
2656,Blue Dragon Embroidered Round Neck 100% T-Shirt For Men,,,0,0,550,0,550.0,Other
2657,Maroon Embroidered Round Neck 100% T-Shirt For Men,,,0,0,550,0,550.0,Other
2660,Grey Dragon Embroidered Round Neck 100% T-Shirt For Men,,,0,0,550,0,550.0,Other
2662,Black Dragon Embroidered Round Neck 100% T-Shirt For Men,,,0,0,550,0,550.0,Other
2663,Black Cotton Printed T-Shirt For Men,,,0,650,411,239,411.0,Other
2664,The Beatles Printed Casual Cotton T-Shirt For Men,,,0,0,450,0,450.0,Other
2665,Maroon Round Neck Half Sleeve Tie-Dye Printed T-Shirt For Men,,,0,0,700,0,700.0,Other
2666,Grey Round Neck Half Sleeve Tie-Dye Printed T-Shirt For Men,,,0,0,700,0,700.0,Other
2667,Green Round Neck Half Sleeve Tie-Dye Printed T-Shirt For Men,,,0,0,700,0,700.0,Other
2668,Police F521 Bodysize Round Neck T-Shirt For Men- Top,4.0,1.0,0,0,1699,0,1699.0,police
2669,Grey Cotton Round Neck Half Sleeve Tie-Dye Printed T-Shirt For Men's,,,0,0,500,0,500.0,Other
2670,Police Barbari Solid Round Neck T-Shirt For Men Brl1,,,0,0,2340,0,2340.0,police
2671,Full Sleeve Blue Casual Cotton T-Shirt For Men,3.5,2.0,0,0,650,0,650.0,Other
2673,Kurt Happy Face T-Shirt For Men,3.0,1.0,0,0,650,0,650.0,Other
2674,Men Fender Guitar T-Shirt,5.0,1.0,0,0,950,0,950.0,Other
2675,Pack Of 3 Plain 100% Cotton T-Shirt For Men- Blue/White/Grey,,,0,1900,899,1001,299.6666666666667,Other
2676,White Full Cotton T-shirt For Men,4.0,1.0,0,0,600,0,600.0,Other
2677,Buddha Scars Print T-Shirts,,,0,0,650,0,650.0,Other
2678,Orange Color Premium Cotton Round Neck Half Sleeves Ride Printed Graphic T-shirt For Men,,,0,0,1490,0,1490.0,Other
2679,Iron Mask Tech Printed T-Shirt For Men,,,0,0,650,0,650.0,Other
2680,Winter Coming Golden Print T-Shirts,,,0,0,650,0,650.0,Other
2681,Police Bc013 Big Size V-Neck T-Shirt For Men- Blue,,,0,0,2199,0,2199.0,police
2682,Pack Of 3 Floral Embroidered 100% Cotton T-Shirt For Men-Green/Grey/Black,,,0,0,1400,0,466.6666666666667,Other
2684,Avenger Endgame Printed T-Shirt For Men,,,0,0,850,0,850.0,Other
2685,Black Dragon Ball Z Fusion T-Shirt For Men,3.5,2.0,0,0,750,0,750.0,Other
2686,Bossini Knitted T-Shirts 223103102062 Black For Men,5.0,1.0,0,0,4190,0,4190.0,Bossini
2687,Men's Printed Tshirt,,,0,0,2400,0,2400.0,Other
2690,Men's Printed Tshirt,,,0,0,2100,0,2100.0,Other
2691,Men's Printed Tshirt,,,0,0,2000,0,2000.0,Other
2692,Men's Printed Tshirt,,,0,0,2500,0,2500.0,Other
2694,Nirvana by Free Authority Grey Tshirt for Men STY-20-21-000298,,,0,2997,1199,1798,1199.0,Other
2695,Black / White Half Baseball Streetwear T-Shirt For Men,,,0,1999,979,1020,979.0,Other
2696,Super Dad | Father's Day T-Shirt for Men | Multi size | Gift for Dad,,,0,0,1000,0,1000.0,Other
2697,Joker by Free Authority White Tshirt for Men JK0GMT183,,,0,2097,999,1098,999.0,Other
2698,White Printed Round Neck Cotton T-Shirt For Men,,,0,0,650,0,650.0,Other
2699,Pack Of 3 Buddha Printed 100% Cotton T-Shirt For Men-Maroon/Grey/Black,,,0,0,1000,0,333.3333333333333,Other
2700,Pack Of 3 Buddha Printed 100% Cotton T-Shirt For Men-Black/White/Maroon -019,,,0,0,1000,0,333.3333333333333,Other
2701,Pack Of 3 Eye Printed 100% Cotton T-Shirt For Men-Red/Yellow/Black,,,0,0,1000,0,333.3333333333333,Other
2702,Pack Of 3 Mandala Printed 100% Cotton T-Shirt For Men-Red/White/Black - 023,,,0,0,1000,0,333.3333333333333,Other
2703,Pack Of 3 Mandala Printed 100% Cotton T-Shirt For Men-Red/White/Blue - 023,,,0,0,1000,0,333.3333333333333,Other
2704,Pack Of 3 Mandala Printed 100% Cotton T-Shirt For Men-Black/Red/Green - 023,,,0,0,1000,0,333.3333333333333,Other
2705,Pack Of 3 Mandala Printed 100% Cotton T-Shirt For Men-Blue/Red/Green - 023,,,0,0,1000,0,333.3333333333333,Other
2706,Men's Pack Of 3 Half Sleeve Printed 100% Cotton T-Shirt -Green/Yellow/Black,,,0,0,1000,0,333.3333333333333,Other
2707,Pack Of 3 Half Sleeve Printed 100% Cotton T-Shirt For Men-Red/Light Blue/Black,,,0,0,1000,0,333.3333333333333,Other
2709,Police F546 Bodysize Round Neck Cotton T-Shirt - Grey,,,0,0,1699,0,1699.0,police
2710,The Beatles by Free Authority Grey Tshirt for Men STY-19-20-000023,,,0,2097,1299,798,1299.0,Other
2711,Round Neck Cotton Fabric Summer T-Shirt For Men - Teal | One Size | Fashion | Summer T-Shirts For Men,4.5,2.0,0,0,600,0,600.0,Other
2712,Avenger Circles Print T-Shirts For Men,3.0,1.0,0,0,650,0,650.0,Other
2713,Blue Cotton Round Neck Half Sleeve Plain T-Shirt For Men,,,0,0,900,0,900.0,Other
2714,Maroon Cotton Round Neck Half Sleeve Newari Mandala Printed T-Shirt For Men's,,,0,0,400,0,400.0,Other
2715,Oxemberg Red Printed Roundneck T-Shirt For Men,,,0,0,1699,0,1699.0,oxemberg
2716,Tshirt - Light Cotton White (R-Neck),,,0,0,1200,0,1200.0,Other
2717,Hulk by Free Authority Green Tshirt for Men STY-18-19-000188,,,0,2097,899,1198,899.0,Other
2718,Dark Green 'Dari Baba' Printed T-Shirt For Men,,,0,0,650,0,650.0,Other
2719,Bossini Crew Neck Knitted T-Shirts 223103103062 Dark Blue For Men,5.0,1.0,0,0,4790,0,4790.0,Bossini
2721,Black Everest Printed 100% T-Shirt For Men,,,0,0,350,0,350.0,Other
2722,Police F503 Bodysize V-Neck T-Shirt For Men- Black,,,0,0,1999,0,1999.0,police
2723,Blue Sports T-Shirt For Men,,,0,0,1050,0,1050.0,Other
2725,Jimi Hendrix Kid Print Men T-Shirt,4.0,2.0,0,0,650,0,650.0,Other
2726,Dark Brown/Ivory Yellow/Black Color Round Neck Half Sleeves Plain Design T-Shirt For Men Set Of 3,5.0,1.0,0,0,2100,0,2100.0,Other
2727,Hummel Burgundy Cotton T-Shirt For Men,,,0,0,2590,0,2590.0,hummel
2728,Naruto Printed Tshirt for Men,5.0,1.0,0,1065,852,213,852.0,Other
2729,Black 100% Cotton Timepiece Printed T-Shirt For Men,,,0,0,750,0,750.0,Other
2730,Stay Strong Printed Tshirt for Men,4.0,2.0,0,1065,852,213,852.0,Other
2731,Black/White Dragon Ball-Z Character Printed T-Shirt For Men,,,0,0,650,0,650.0,Other
2732,Dark Gray Pure Cotton Plain T-Shirt/ Summer Wear For Men.,,,0,600,399,201,399.0,Other
2734,Oxemberg pink polo t-shirt with pocket for men,,,0,0,1799,0,1799.0,oxemberg
2735,Men's Workout Hooded T-shirt,,,0,0,799,0,799.0,Other
2737,Green PUBG Printed T-Shirt For Men,3.0,2.0,48,0,650,0,650.0,Other
2738,Blue Gurkha Printed T-Shirt For Men,,,0,0,650,0,650.0,Other
2740,Relationshit Golden Print T-Shirt,,,0,0,550,0,550.0,Other
2741,Navy Dirt Printed Round Neck T-Shirt For Men,3.8,5.0,0,0,900,0,900.0,Other
2742,Black-Lamb Of God Printed T-Shirt For Men,,,0,0,450,0,450.0,Other
2743,Combo Of 2 Cotton Tie Dye T-Shirt For Men- Multicolored,,,0,0,1150,0,575.0,Other
2744,Pack Of 3 Mandala 100% T-Shirt For Men-Maroon/Blue/Dark Green - 03,,,0,0,1100,0,366.6666666666667,Other
2745,Tokyo Urban Concepts Combed Cotton Tshirt for Men,5.0,1.0,0,1065,852,213,852.0,Other
2746,Holi Plain White Round Neck T-Shirt For Men,5.0,2.0,0,0,400,0,400.0,Other
2747,Combo of 3 Cotton Round Neck T-Shirt For Men (Navy Blue/Maroon/Green),3.8,6.0,0,0,1500,0,500.0,Other
2749,Gents Park White Color Plain Design Round Neck Half Sleeves T-Shirt For Men,1.0,1.0,0,0,1165,0,1165.0,Gents Park
2750,Black Dota Sven Head Printed T-Shirt For Men,,,0,0,650,0,650.0,Other
2751,Pack Of 3 Plain 100% T-Shirt For Men-Green/Grey/Blue,,,0,0,900,0,300.0,Other
2752,Pack Of 3 Plain 100% T-Shirt For Men-Pink/Yellow/Sky Blue,,,0,0,900,0,300.0,Other
2753,Pack Of 3 Plain 100% T-Shirt For Men- Green/Black/Grey,,,0,0,800,0,266.6666666666667,Other
2757,Black Color Half T-shirt For Men,,,0,0,1050,0,1050.0,Other
2758,Police Ft7 Bodysize V Neck T-Shirt - Navy Blue,,,0,0,2155,0,2155.0,police
2759,Kakashi Anbu Character Prainted T-shirts,,,0,0,750,0,750.0,Other
2760,Police Oversized Solid T-Shirt For Men (Ob-02),,,0,0,2399,0,2399.0,police
2761,White/Black Stambha Design Cotton T-Shirt For Men,,,0,0,650,0,650.0,Other
2762,Bob Dylan Printed T-Shirt For Men,,,0,0,650,0,650.0,Other
2763,Jon N King Print T-Shirt For Men,,,0,0,650,0,650.0,Other
2764,Game Of Thrones Golden Printed T-Shirt For Men,,,0,0,650,0,650.0,Other
2765,Yinyang Pubg Printed T-Shirt For Men,,,0,0,650,0,650.0,Other
2766,Pubg Sss Printed T-Shirt For Men,,,0,0,650,0,650.0,Other
2767,Grey/Black Okhal Design Cotton T-Shirt For Men,,,0,0,650,0,650.0,Other
2768,Combo Of 2 V-Neck T-Shirts - Navy/White,5.0,1.0,0,0,1200,0,600.0,Other
2769,Black/White Dragon Ball-Z Single Character Printed T-Shirt For Men,,,0,0,750,0,750.0,Other
2770,Black Game Of Thrones Printed T-Shirt For Men,,,0,0,750,0,750.0,Other
2771,Maroon Fifa World Cup Russia 2018 Printed T-Shirt For Men,,,0,0,650,0,650.0,Other
2772,Among Us Character Printed T-shirt For Men,,,0,0,650,0,650.0,Other
2774,Black Plain Cotton T-Shirt For Men,5.0,1.0,0,0,500,0,500.0,Other
2775,Green Color Cotton Round Neck Half Sleeve Printed T-Shirt For Men,,,0,1899,1450,449,1450.0,Other
2777,Vox Amp Tshirt,5.0,1.0,0,0,800,0,800.0,Other
2778,White Color Cotton Round Neck Half Sleeve Printed T-Shirt For Men,,,0,1699,1250,449,1250.0,Other
2779,Pubg Japanese Print T-Shirt For Men,2.0,1.0,0,0,650,0,650.0,Other
2780,Grey / Green Color Soft Cotton Zip Neck Design Full Sleeve Summer T-shirt For Men,,,0,1750,1299,451,1299.0,Other
2781,Grey Cotton Round Neck Half Sleeve Tie-Dye Printed T-Shirt For Men,3.0,2.0,0,0,1100,0,1100.0,Other
2782,Grey Color Cotton Round Neck Half Sleeves T-shirt For Men,,,0,0,420,0,420.0,Other
2784,Maroon Pure Cotton Plain T-Shirt/ Summer Wear For Men.,3.0,1.0,0,600,399,201,399.0,Other
2785,Star Wars by Free Authority Blue Tshirt for Men STY-18-19-000119,,,0,2397,1099,1298,1099.0,Other
2787,"Men Printed Premium Quality Round Neck Polyester T-Shirt (Sky Blue, Teal)",,,0,1200,790,410,790.0,Other
2788,Grey Collar Neck Half Sleeve T-Shirt For Men,,,0,0,650,0,650.0,Other
2789,FuLoo’s Bravo Active T-shirt for Men in Blue,,,0,0,1400,0,1400.0,Fuloos
2790,White/Black Temple Design Cotton T-Shirt For Men,,,0,0,650,0,650.0,Other
2791,Black / White Full Sleeve Baseball Summer Tee For Men,,,0,1999,989,1010,989.0,Other
2792,Pink Cotton Plain Round Neck Half Sleeves Regular Fit T-shirt For Men,,,0,1695,1130,565,1130.0,Other
2793,Fortnite All Characters Printed T-Shirt For Men,5.0,1.0,0,0,650,0,650.0,Other
2794,Red Cotton Round Neck Half Sleeve Plain T-Shirt For Men,,,0,0,900,0,900.0,Other
2795,Pack Of 3 Buddha Printed 100% T-Shirt For Men-Blue/Red/Maroon,,,0,0,1000,0,333.3333333333333,Other
2796,Pack Of 3 Buddha Printed 100% T-Shirt For Men-Green/White/Black,,,0,0,1000,0,333.3333333333333,Other
2797,Pack Of 3 Buddha Printed 100% T-Shirt For Men-Green/White/Blue,,,0,0,1000,0,333.3333333333333,Other
2798,Pack Of 3 Ganesh Printed 100% T-Shirt For Men-Black/Grey/Green - 016,,,0,0,1000,0,333.3333333333333,Other
2799,White V-Neck T-Shirt For Men,5.0,1.0,0,0,650,0,650.0,Other
2800,Golden Bhairab Printed Cotton Black T-Shirt For Men,,,0,0,450,0,450.0,Other
2801,Pack of 2 Cotton Polo T-Shirt For Men,5.0,2.0,0,0,1400,0,700.0,Other
2803,Tshirt - Knitwear Maroon (R-Neck),,,0,0,2250,0,2250.0,Other
2804,Black Om Nama Shiva Printed T-Shirt For Men,,,0,0,750,0,750.0,Other
2805,Men's Combo Soft T-shirt And Jogger Set,,,0,3290,1890,1400,1890.0,Other
2806,Betta Fish Tshirt for Men,3.0,1.0,0,1065,852,213,852.0,Other
2807,Dota Character Invoker T-Shirt For Men,3.0,1.0,0,0,650,0,650.0,Other
2808,Pack Of 3 Plain 100% Cotton T-Shirt For Men-Pink/Yellow/Sky Blue,,,0,0,1125,0,375.0,Other
2809,Plain summer type T-Shirt for Men,2.0,2.0,0,0,1250,0,1250.0,Other
2810,Batman by Free Authority Green Tshirt for Men STY-18-19-004438,4.0,1.0,0,2097,1599,498,1599.0,Other
2811,Anbu Face Mask Character Printed T-shirts,,,0,0,750,0,750.0,Other
2812,Maroon/Black T-Shirt For Men,,,0,899,725,174,725.0,Other
2813,Dragon Ball-Z Multi Character Printed T-Shirt For Men,5.0,1.0,0,0,750,0,750.0,Other
2814,Plain Cotton Half T-Shirt For Men,4.0,1.0,0,900,750,150,750.0,Other
2815,Jordan T-Shirt And Shorts Set For Men - Fashion | T-shirts For Men | Men's Wear | T-Shirts | Shorts |,5.0,1.0,0,2990,1490,1500,1490.0,Other
2816,Vedor Spray Printed T-shirts,4.0,1.0,0,0,750,0,750.0,Other
2817,Pubg Rush Multi-Color T-Shirt,,,0,0,650,0,650.0,Other
2818,Dota Character Printed T-Shirt For Men,3.0,1.0,0,0,650,0,650.0,Other
2819,PIAZZAITALIA Polo In Piquet For Men - 25691,5.0,3.0,0,0,2085,0,2085.0,piazzaitalia
2820,Venom Comic Print T-Shirts,5.0,1.0,0,0,750,0,750.0,Other
2821,White/Black Swayambhunath Designed Cotton T-Shirt For Men,,,0,0,650,0,650.0,Other
2822,Police Trs2 Round Neck Striped T-Shirt For Men-Black & White,2.0,1.0,0,0,2463,0,2463.0,police
2823,Green Fifa World Cup Portugal 2018 Printed T-Shirt For Men,,,0,0,650,0,650.0,Other
2824,Green Cotton Round Neck Mandala Embroidered T-Shirt For Men,,,0,0,650,0,650.0,Other
2825,"Star War Inspired, Stop War Men T-Shirt",3.7,3.0,0,0,850,0,850.0,Other
2826,Police Fc036 Bodysize Round Neck Full Sleeves T-Shirt - Yellow,,,0,0,1999,0,1999.0,police
2827,Abcd Recycle Printed T-shirts,,,0,0,750,0,750.0,Other
2828,Green Ganesh Printed T-Shirt For Men,,,0,0,370,0,370.0,Other
2829,Mandala Printed T-Shirt For Men,,,0,0,750,0,750.0,Other
2830,Kurt Cobain Design Wear Sound Print For Men T-shirt,,,0,0,650,0,650.0,Other
2831,Pubg Pan Logo T-Shirt For Men,,,0,650,550,100,550.0,logo
2832,White 'Angry Birds Returns' Printed Cotton Unisex T-Shirts,,,0,0,650,0,650.0,Other
2833,Green Om Nama Shiva Printed T-Shirt For Men,,,0,0,750,0,750.0,Other
2834,Avenger All Character Print Men T-Shirts,,,0,0,650,0,650.0,Other
2836,Sea Green V-Neck T-Shirt For Men,,,0,0,650,0,650.0,Other
2839,(Pack of 3) ONN Men Round Neck Half Sleeve T-shirt - Fashion | T-Shirts For Men | Men's Wear | T-Shirts |,5.0,1.0,0,0,3395,0,1131.6666666666667,Other
2840,Black Round Neck Shiva Printed T-Shirt For Men,,,0,0,650,0,650.0,Other
2841,Maroon Color Premium Cotton Round Neck Half Sleeves Printed Graphic T-shirt For Men,,,0,0,1490,0,1490.0,Other
2842,Cotton Casual Vest Plain,,,0,450,329,121,329.0,Other
2843,Pack Of 3 Buddha Printed 100% T-Shirt For Men-Blue/Red/Green - 05,,,0,0,1100,0,366.6666666666667,Other
2844,Pack Of 3 Mandala Printed 100% T-Shirt For Men-Black/White/Green - 023,,,0,0,1100,0,366.6666666666667,Other
2845,Pack Of 3 Buddha Printed 100% T-Shirt For Men-Black/White/Maroon -019,,,0,0,1100,0,366.6666666666667,Other
2846,Pack Of 3 Eye Printed 100% T-Shirt For Men-Maroon/Grey/Black,,,0,0,1100,0,366.6666666666667,Other
2847,FuLoo’s Bravo Active T-shirt for Men in Teal,,,0,0,1400,0,1400.0,Fuloos
2848,Hulk by Free Authority Black Tshirt for Men HK0FMT102,,,0,2397,1799,598,1799.0,Other
2849,Black Dragon Ball Z T-Shirt For Men,,,0,0,650,0,650.0,Other
2850,Police Fc029 Bodysize Full Sleeve T-Shirt - Green,,,0,0,1799,0,1799.0,police
2851,Pack of 3 Plain T-shirt for Men,,,0,0,975,0,325.0,Other
2852,Police F507 Bodysize Round Neck T-Shirt For Men- Top,,,0,0,1999,0,1999.0,police
2853,Sacramento Green Rick And Morty Forever Printed T-Shirt For Men,,,0,0,650,0,650.0,Other
